{
  "$schema": "https://json-schema.org/draft/2020-12/schema",
  "$id": "https://fabio-ara.github.io/AraLearn/authoring/schemas/reopen.schema.json",
  "title": "Reabertura de uma parte após a validação final",
  "type": "object",
  "required": ["artifact", "version", "runId", "partKey", "requestId", "attempt", "submissionSha256", "decision", "findings"],
  "properties": {
    "artifact": { "const": "aralearn.final-validation-repair" },
    "version": { "const": 1 },
    "runId": { "$ref": "common.schema.json#/$defs/uuid" },
    "partKey": { "$ref": "common.schema.json#/$defs/partKey" },
    "requestId": { "$ref": "common.schema.json#/$defs/requestId" },
    "attempt": { "type": "integer", "minimum": 1, "maximum": 8 },
    "submissionSha256": { "$ref": "common.schema.json#/$defs/hash" },
    "decision": { "enum": ["repair", "rebuild"] },
    "findings": {
      "type": "array",
      "maxItems": 100,
      "items": { "$ref": "common.schema.json#/$defs/finding" }
    },
    "instructions": { "type": "string", "maxLength": 20000 }
  },
  "anyOf": [
    { "properties": { "findings": { "type": "array", "minItems": 1 } } },
    { "required": ["instructions"], "properties": { "instructions": { "type": "string", "minLength": 1 } } }
  ],
  "additionalProperties": false
}
