{
  "artifact": "aralearn.final-validation-repair",
  "version": 1,
  "runId": "11111111-1111-4111-8111-111111111111",
  "partKey": "part-conjuncao",
  "requestId": "reopen-conjuncao-0001",
  "attempt": 1,
  "submissionSha256": "cccccccccccccccccccccccccccccccccccccccccccccccccccccccccccccccc",
  "decision": "repair",
  "findings": [
    {
      "issueId": "final-feedback",
      "severity": "error",
      "gate": "feedback",
      "pointer": "/microsequences/0/cards/1/after",
      "observed": "O feedback não explica o erro.",
      "requiredChange": "Explicar por que uma única proposição verdadeira não basta.",
      "preserveFields": [
        "/microsequences/0/cards/1/id",
        "/microsequences/0/cards/1/options"
      ],
      "acceptanceTest": "O feedback diferencia a resposta correta dos distratores."
    }
  ],
  "instructions": "Corrija somente o feedback indicado."
}
